{
  "schemaVersion": "1.0.0",
  "narrativeId": "audience:light-delay-master",
  "sourceOutlineId": "outline:light-delay-master-narrative",
  "entries": [
    {
      "id": "audience:dialogue:p2-harlan-wish",
      "sourceStepId": "master:story-p2",
      "speakerId": "character:harlan",
      "intent": {
        "es": "Harlan deja escapar una pena sincera que también oculta que ya ha elegido actuar contra la misión.",
        "en": "Harlan lets genuine regret escape while concealing that he has already chosen to act against the mission."
      },
      "delivery": {
        "en": { "es": "Muy bajo y contenido; una pausa mínima antes de right y sin autocompasión.", "en": "Very low and contained; a tiny hesitation before ‘right,’ with no self-pity." },
        "es": { "es": "Muy bajo, con cadencia porteña contenida; apoyar apenas razón, sin sentimentalismo.", "en": "Very low, with restrained Buenos Aires cadence; place slight weight on ‘razón,’ without sentimentality." }
      }
    },
    {
      "id": "audience:dialogue:p2-harlan-door",
      "sourceStepId": "master:story-p2",
      "speakerId": "character:harlan",
      "intent": { "es": "Convierte un temor político en una conclusión que parece inevitable.", "en": "He turns political fear into a conclusion that sounds inevitable." },
      "delivery": {
        "en": { "es": "Digno y preciso; crecer desde door hasta walk through sin levantar la voz.", "en": "Dignified and precise; build from ‘door’ to ‘walk through’ without raising volume." },
        "es": { "es": "Pulido y persuasivo; marcar puerta y cuándo atravesarla como pruebas, no como retórica.", "en": "Polished and persuasive; stress ‘puerta’ and ‘cuándo atravesarla’ as evidence, not rhetoric." }
      }
    },
    {
      "id": "audience:dialogue:p2-sorell-respect",
      "sourceStepId": "master:story-p2",
      "speakerId": "character:sorell",
      "intent": { "es": "Sorell defiende su cautela como rigor ético, herida porque Voss la confundió con miedo.", "en": "Sorell defines caution as disciplined interpretation rather than reluctance, refusing to mistake the first plausible reading for knowledge." },
      "delivery": {
        "en": { "es": "Cálida pero firme; acelerar levemente la primera frase y separar fear de respect.", "en": "Warm, deliberate, and intellectually exact. Let the procedural clauses gather momentum, then land ‘respect’ as a quiet correction rather than a plea." },
        "es": { "es": "Expresiva y culta; contener la ofensa hasta una pausa limpia entre miedo y respeto.", "en": "Expressive and cultivated; contain the hurt until a clean pause between ‘miedo’ and ‘respeto.’" }
      }
    },
    {
      "id": "audience:dialogue:p2-voss-doubt",
      "sourceStepId": "master:story-p2",
      "speakerId": "character:voss",
      "intent": {
        "es": "Voss zanja lo que cree dudas compartidas ordinarias y revela que ha aplanado dos advertencias distintas en la misma preocupación manejable.",
        "en": "Voss settles what he believes are ordinary shared doubts, revealing that he has flattened two fundamentally different warnings into the same manageable concern."
      },
      "delivery": {
        "en": {
          "es": "Voz de mando mesurada y tranquilizadora. Dar a part of the job el peso calmado de una doctrina cerrada, pausar y hacer We go anyway decisivo.",
          "en": "Measured, reassuring command voice. Give ‘part of the job’ the calm weight of settled doctrine, pause briefly, then make ‘We go anyway’ decisive enough to close discussion."
        },
        "es": {
          "es": "Cadencia de mando serena y cercana. Apoyar forma parte del trabajo como doctrina cerrada, pausar y cerrar con vamos de todos modos sin abrir debate.",
          "en": "Calm, familiar command cadence. Place doctrine weight on ‘forma parte del trabajo,’ pause, then close with ‘vamos de todos modos’ so discussion ends."
        }
      }
    },
    {
      "id": "audience:dialogue:p2-zao-not-hope",
      "sourceStepId": "master:story-p2",
      "speakerId": "character:zao",
      "intent": { "es": "Zao entrega un diagnóstico humano tan seco como una lectura de ingeniería.", "en": "Zao delivers a human diagnosis as dryly as an engineering reading." },
      "delivery": {
        "en": { "es": "Íntimo, bajo y absolutamente seguro; apoyar hope y cortar.", "en": "Private, low, and absolutely certain; land on ‘hope’ and stop." },
        "es": { "es": "Sobrio y concluyente; apoyar esperanza con una caída tonal, sin explicar más.", "en": "Restrained and conclusive; place a falling stress on ‘esperanza,’ then offer no explanation." }
      }
    },
    {
      "id": "audience:dialogue:p2-voss-faults",
      "sourceStepId": "master:story-p2",
      "speakerId": "character:voss",
      "intent": { "es": "Voss intenta tranquilizarla y, sin saberlo, descarta la advertencia correcta.", "en": "Voss means to reassure her and unknowingly dismisses the correct warning." },
      "delivery": {
        "en": { "es": "Barítono sereno con afecto profesional; la segunda frase es una corrección amable, no un reto.", "en": "Calm baritone with professional affection; the second sentence is a gentle correction, not a rebuke." },
        "es": { "es": "Cadencia institucional y cercana; una pausa pensada antes de todos, sin condescendencia.", "en": "Institutional but familiar cadence; a considered pause before ‘todos,’ never condescending." }
      }
    },
    {
      "id": "audience:dialogue:a3-voss-on-time",
      "sourceStepId": "master:story-a3",
      "speakerId": "character:voss",
      "intent": { "es": "Voss expresa confianza cotidiana en Zao y le concede el tiempo que pide.", "en": "Voss expresses routine trust in Zao and grants the time she asks for." },
      "delivery": {
        "en": { "es": "Ligero y seguro, casi casual; repetir on time con cierre definitivo.", "en": "Light and assured, almost casual; repeat ‘on time’ with a definitive close." },
        "es": { "es": "Autoridad relajada; las dos apariciones de vamos a tiempo suenan a confianza, no a impaciencia.", "en": "Relaxed authority; both instances of ‘vamos a tiempo’ should sound trusting, not impatient." }
      }
    },
    {
      "id": "audience:dialogue:a3b-sorell-no-return",
      "sourceStepId": "master:story-a3b",
      "speakerId": "character:sorell",
      "intent": { "es": "Sorell vuelve audible la irreversibilidad que todos ya sienten.", "en": "Sorell makes audible the irreversibility everyone already feels." },
      "delivery": {
        "en": { "es": "Sin prisa, con gravedad tranquila; dejar espacio antes de no turning around.", "en": "Unhurried, with quiet gravity; leave space before ‘no turning around.’" },
        "es": { "es": "Solemne pero conversacional; pausa después de regreso y caída firme en no hay vuelta atrás.", "en": "Solemn but conversational; pause after ‘regreso’ and fall firmly through ‘no hay vuelta atrás.’" }
      }
    },
    {
      "id": "audience:dialogue:a3c-okoye-aggressive",
      "sourceStepId": "master:story-a3c",
      "speakerId": "character:okoye",
      "intent": { "es": "Okoye informa lo que ve con una ironía apenas perceptible.", "en": "Okoye reports what she sees with barely perceptible irony." },
      "delivery": {
        "en": { "es": "Directo y observacional; un matiz seco en too aggressive, sin convertirlo en chiste.", "en": "Direct and observational; a dry shade on ‘too aggressive,’ without turning it into a joke." },
        "es": { "es": "Dicción ecuatoguineana formal y nítida; apoyar demasiado agresiva con sobriedad.", "en": "Crisp formal Equatoguinean diction; give restrained weight to ‘demasiado agresiva.’" }
      }
    },
    {
      "id": "audience:dialogue:a3c-elin-phallus",
      "sourceStepId": "master:story-a3c",
      "speakerId": "character:rao",
      "intent": { "es": "Elin encuentra una descripción técnicamente exacta y socialmente incómoda.", "en": "Elin finds a description that is technically exact and socially awkward." },
      "delivery": {
        "en": { "es": "Deadpan absoluto; ritmo analítico continuo y ninguna sonrisa audible.", "en": "Absolute deadpan; one continuous analytical rhythm, with no audible smile." },
        "es": { "es": "Seca, directa y un poco más rápida al llegar a falo; decir Ardor Celestial como dato técnico.", "en": "Dry, direct, and slightly quicker on ‘falo’; say ‘Ardor Celestial’ as technical data." }
      }
    },
    {
      "id": "audience:dialogue:a3c-elin-name",
      "sourceStepId": "master:story-a3c",
      "speakerId": "character:rao",
      "intent": { "es": "Elin se defiende del absurdo que acaba de señalar sin abandonar el deadpan.", "en": "Elin disowns the absurdity she just identified without breaking deadpan." },
      "delivery": {
        "en": { "es": "Muy breve; micro pausa antes de name y final seco.", "en": "Very brief; a micro-pause before ‘name,’ ending dry." },
        "es": { "es": "Casi sin inflexión; apoyar yo apenas, como una precisión necesaria.", "en": "Nearly flat; lightly stress ‘yo’ as a necessary correction." }
      }
    },
    {
      "id": "audience:dialogue:a3c-sorell-greeting",
      "sourceStepId": "master:story-a3c",
      "speakerId": "character:sorell",
      "intent": { "es": "Sorell recoge la broma y la devuelve al trabajo sin apagar la camaradería.", "en": "Sorell catches the joke and turns it back toward the work without killing the camaraderie." },
      "delivery": {
        "en": { "es": "Ágil y cálida, con una sonrisa mínima; énfasis práctico en less ambiguous.", "en": "Agile and warm, with the smallest smile; practical emphasis on ‘less ambiguous.’" },
        "es": { "es": "Culta pero ligera; hagamos incluye al grupo y menos ambiguo vuelve al problema real.", "en": "Cultivated but light; ‘hagamos’ includes the group and ‘menos ambiguo’ returns to the real problem." }
      }
    },
    {
      "id": "audience:dialogue:a3c-okoye-hello",
      "sourceStepId": "master:story-a3c",